{
  "$schema": "https://json-schema.org/draft/2020-12/schema",
  "$id": "https://ernie.sg/schemas/pdf-extraction-eval-providers-1.0.0.json",
  "title": "Extraction benchmark provider comparison manifest",
  "type": "object",
  "additionalProperties": false,
  "required": [
    "schemaVersion",
    "id",
    "evalSet",
    "evaluationStatus",
    "providers"
  ],
  "properties": {
    "schemaVersion": { "const": "1.0.0" },
    "id": { "$ref": "#/$defs/id" },
    "evalSet": {
      "type": "object",
      "additionalProperties": false,
      "required": ["path", "fileSha256", "evalSetSha256"],
      "properties": {
        "path": {
          "type": "string",
          "pattern": "^[A-Za-z0-9._/-]+$"
        },
        "fileSha256": { "$ref": "#/$defs/sha256" },
        "evalSetSha256": { "$ref": "#/$defs/sha256" }
      }
    },
    "evaluationStatus": {
      "enum": ["reported-only", "comparison-ready"]
    },
    "providers": {
      "type": "array",
      "minItems": 1,
      "items": { "$ref": "#/$defs/provider" }
    }
  },
  "$defs": {
    "id": {
      "type": "string",
      "pattern": "^[A-Za-z0-9][A-Za-z0-9._:-]{0,127}$"
    },
    "sha256": {
      "type": "string",
      "pattern": "^[a-f0-9]{64}$"
    },
    "provider": {
      "type": "object",
      "additionalProperties": false,
      "required": [
        "id",
        "kind",
        "version",
        "mode",
        "sourceIdentitySha256",
        "predictionsPath",
        "predictionsSha256"
      ],
      "properties": {
        "id": { "$ref": "#/$defs/id" },
        "kind": { "enum": ["deterministic", "candidate"] },
        "version": { "$ref": "#/$defs/id" },
        "mode": { "enum": ["abstain", "file"] },
        "sourceIdentitySha256": {
          "oneOf": [{ "type": "null" }, { "$ref": "#/$defs/sha256" }]
        },
        "predictionsPath": {
          "oneOf": [
            { "type": "null" },
            {
              "type": "string",
              "pattern": "^[A-Za-z0-9._/-]+$"
            }
          ]
        },
        "predictionsSha256": {
          "oneOf": [{ "type": "null" }, { "$ref": "#/$defs/sha256" }]
        }
      },
      "oneOf": [
        {
          "properties": {
            "mode": { "const": "abstain" },
            "predictionsPath": { "const": null },
            "predictionsSha256": { "const": null }
          }
        },
        {
          "properties": {
            "mode": { "const": "file" },
            "predictionsPath": {
              "type": "string",
              "pattern": "^[A-Za-z0-9._/-]+$"
            },
            "predictionsSha256": { "$ref": "#/$defs/sha256" }
          }
        }
      ]
    }
  }
}
