{
  "schemaVersion": "1.0.0",
  "id": "scholarly-pdf-extraction-provider-comparison-2026-08-v1",
  "evalSet": {
    "path": "benchmarks/pdf/extraction-eval-strata-v1.json",
    "fileSha256": "4708145c2660fca302e3f1a9e6f4f126e9dac75c62143165b3f746b694b68d76",
    "evalSetSha256": "4bdda41446d0e4b34ff69aa3daa5e9320752fdb11c13d4bfb5409b77fa95c34b"
  },
  "evaluationStatus": "reported-only",
  "providers": [
    {
      "id": "deterministic-path",
      "kind": "deterministic",
      "version": "source-backed-fixture-path-v1",
      "mode": "abstain",
      "sourceIdentitySha256": null,
      "predictionsPath": null,
      "predictionsSha256": null
    },
    {
      "id": "candidate-provider-a",
      "kind": "candidate",
      "version": "reported-only-a-v1",
      "mode": "abstain",
      "sourceIdentitySha256": null,
      "predictionsPath": null,
      "predictionsSha256": null
    },
    {
      "id": "candidate-provider-b",
      "kind": "candidate",
      "version": "reported-only-b-v1",
      "mode": "abstain",
      "sourceIdentitySha256": null,
      "predictionsPath": null,
      "predictionsSha256": null
    }
  ]
}
